{
  "id": "DEMO-1",
  "title": "Add user profile endpoint and profile page",
  "status": "done",
  "priority": 10,
  "depends_on": [],
  "user_story": "As a registered user, I want to view and edit my profile information so that other users can identify me.",
  "acceptance": [
    "User can view their own profile with name, bio, and avatar",
    "User can update their name and bio via a form",
    "Avatar upload accepts JPEG and PNG up to 2MB",
    "Changes persist after page refresh",
    "Profile page shows a 404 state for non-existent user IDs"
  ],
  "be_scope": "Create GET /users/:userId/profile, PATCH /users/:userId/profile, and POST /users/:userId/avatar endpoints. All authenticated endpoints must use the existing AuthMiddleware. Avatar uploads are stored via StorageService.",
  "be_constraints": [
    "Use AuthMiddleware from src/middleware/auth.ts for authenticated endpoints",
    "Return { data, error } envelope on all responses — see src/types/api.ts",
    "Store avatars using the existing StorageService in src/services/storage.ts",
    "Postgres only — no new tables without a migration file"
  ],
  "be_hints": [
    "UserModel is in src/models/user.ts — profile fields may need to be added",
    "The validation middleware is in src/middleware/validate.ts"
  ],
  "fe_scope": "Create a /profile/:userId page that displays the user's profile card with name, bio, and avatar. Add an edit mode (toggle button) that shows a form to update name and bio inline. Add an avatar upload button on the profile page.",
  "fe_constraints": [
    "Use the existing Page component from src/components/layouts/Page.tsx",
    "Use react-hook-form for all forms",
    "Tailwind only — no inline styles",
    "Avatar upload must show a preview before confirming"
  ],
  "fe_hints": [
    "UserCard component in src/components/UserCard.tsx is a good reference for the profile display",
    "Loading states should use the existing Skeleton component from src/components/ui/Skeleton.tsx"
  ],
  "meta": {
    "created_at": "2026-01-15T10:00:00Z",
    "created_by": "Santosh Gopal",
    "labels": ["demo", "profile"],
    "notes": "This is the reference example ticket showing a complete tandem run from queued to done."
  }
}
